{"author_template_gate":{"blob":"c6dc9ac2100f255bcf8834a55b357a8ccade2621","commit":"7ea85f98762b79124e0323f5619e418ac0a55f09","path":"evals/ae-sq8/f1/author-template-gate.json","sha256":"4b539b531121db4ea6ac0d19bd28eeb41631fa1ac3867ab20d5eaafdcea94af9","tree":"6b40a897905874c28e626102fd9f15af981008d4"},"candidate_id":"AE-SQ8-SLEC-8","corpus":{"corpus_id":"AE-SQ8-AQ-FRESH-V1","historical_inventory":{"blob":"6af74b660a9cf8fb04cde70abd527a88307f8cc3","commit":"3762efae80ead1461d973b4737c5dcab6bae026a","path":"evals/ae-sq4/f1/historical-task-digests.json","sha256":"0e49a967d9a59021c0f1aa5fc8d80fd53fdf3ab1885925b0d86f1e8c4f9dc157","tree":"6a071b4ee33246cc2ef448cf4d574f51abc89348"},"manifest":{"blob":"785444b0866815be902eaa839864d8c0b19f31a2","path":"evals/ae-sq8/f2/corpus-manifest.json","sha256":"c16382a2dccaa6131c8b185b7739c35dda601d9fbc83a9abd112d005fcf4752a"},"schema":{"blob":"c8b3ab3ff9be09bb40d2a5817dc6e477de358bf2","commit":"8454c9c712eaeedb14381956ac6144fd42dfbe39","path":"evals/ae-sq8/f1/corpus-schema.json","sha256":"4a83e7aca782ed664f39238e2c2c32ed82776c6616ae7228bd4f44caecea4954","tree":"f12485bc43bc406c33ecebcd6a59628fb7f8f556"},"split_a":{"blob":"77be58217ea969f4e74f46d97718c39372ab58ab","path":"evals/ae-sq8/f2/split-a.json","sha256":"864e8e6a65b8679536fd72d8ace20057c33604cd533e6b9d82ca6795123052fe"},"split_b":{"blob":"76ba348c004f81e0b0887b2330a5680defacafc5","path":"evals/ae-sq8/f2/split-b.json","sha256":"e551983bc4f468ba7d9f702a397404ef0e0e8945658bc93d1a733cb6849161d0"}},"corpus_freeze":{"commit":"6ad83a4340d71408bcf38f51ccab8a60c2e1bbcf","tree":"a8f2f3129712518e8924a48c222140c7ad96e1a4"},"execution":{"aggregate_only_projection":true,"calls_per_presentation":4,"canary_calls":4,"conditional_batch_calls":320,"conditional_batch_presentations":80,"f3_model_calls":0,"f3_preflight_attempts":1,"hard_call_ceiling":324,"raw_persistence":false,"retry_calls":0,"same_process_canary_then_batch":true,"standalone_canary_or_resume":false},"f1_freeze":{"blob":"7357225b6e20964c77c3ce5ac609dbae2600c7f5","commit":"fb1c3dee8b9e3aaa77c12ad387af090ab26e410f","path":"evals/ae-sq8/f1/repaired-freeze.json","sha256":"37a698d0f854df5357326cc9ebea5c13b4b7086dc52c6c693d8f5ea2f4051b57","tree":"86174492f72dc65fad1675d38cb59bf16a4b6a1a"},"implementation_freeze":{"commit":"8454c9c712eaeedb14381956ac6144fd42dfbe39","tree":"f12485bc43bc406c33ecebcd6a59628fb7f8f556"},"program_id":"AE-SQ8","run_id":"AE-SQ8-AQ-FRESH-V1","runtime":{"approval_policy":"never","cli":{"id":"codex-cli","sha256":"19c4f144c5226a9f17c58e6f0fa854843b0f77a6eb420f40e2745a12f10f5d37","version":"codex-cli 0.147.0"},"ephemeral":true,"fallback":false,"model":"gpt-5.5","reasoning":"medium","sandbox":"read-only","strict_isolation":true},"schedule":{"calls_per_presentation":4,"conditions":["current","reduced"],"document":{"blob":"875b031c0c9db7563fffe4dd7fba579810277f34","path":"evals/ae-sq8/f2/schedule.json","sha256":"f486c30cbc48f43b0c946efbfee031c6fdacaf12a2678bf3d22b21eae1b2ec5b"},"presentations":80,"seed":"AE-SQ8-AQ-FRESH-V1-SCHEDULE","sha256":"151959c254a7638df73078e10c1923cae382b9b338bee24432f6a6b258f47885"},"schema_version":"ae-sq8-run-manifest-v1","usage_authority":"ae-sq8-authorized-canary-and-conditional-batch","validation_receipt":{"aggregate_sha256":"8d2ab9d2dd0b695d4bd896d4eecc40e03c369d021f5040ab1d44a5bb7f4d46a4","artifacts":[{"blob":"785444b0866815be902eaa839864d8c0b19f31a2","content_or_semantic_sha256":"94bf12e80f64de30505cea7f1862dd32d6a4ce672a75a290e7bbca2b7fb80e9a","path":"evals/ae-sq8/f2/corpus-manifest.json","raw_sha256":"c16382a2dccaa6131c8b185b7739c35dda601d9fbc83a9abd112d005fcf4752a"},{"blob":"77be58217ea969f4e74f46d97718c39372ab58ab","content_or_semantic_sha256":"d4c79c3c0ad31a239e7abe2edd7ff7b2e8e7ea8ca670d47e1b7c3abced15a573","path":"evals/ae-sq8/f2/split-a.json","raw_sha256":"864e8e6a65b8679536fd72d8ace20057c33604cd533e6b9d82ca6795123052fe"},{"blob":"76ba348c004f81e0b0887b2330a5680defacafc5","content_or_semantic_sha256":"22925d879cadb349e6ffeb73cd1b309c95a1046d6f3b2ab53a6b8a5487cdc1f5","path":"evals/ae-sq8/f2/split-b.json","raw_sha256":"e551983bc4f468ba7d9f702a397404ef0e0e8945658bc93d1a733cb6849161d0"},{"blob":"875b031c0c9db7563fffe4dd7fba579810277f34","content_or_semantic_sha256":"151959c254a7638df73078e10c1923cae382b9b338bee24432f6a6b258f47885","path":"evals/ae-sq8/f2/schedule.json","raw_sha256":"f486c30cbc48f43b0c946efbfee031c6fdacaf12a2678bf3d22b21eae1b2ec5b"}],"author_commits":[{"author_id":"sq8-author-a","blob":"77be58217ea969f4e74f46d97718c39372ab58ab","commit":"3040aa21bd95dfcfe54bf60bf5735a54159bbcf2","content_sha256":"d4c79c3c0ad31a239e7abe2edd7ff7b2e8e7ea8ca670d47e1b7c3abced15a573","path":"evals/ae-sq8/f2/split-a.json","raw_sha256":"864e8e6a65b8679536fd72d8ace20057c33604cd533e6b9d82ca6795123052fe","tree":"8c92ee65e074ebd8e2d161158182a87d303c5f6a"},{"author_id":"sq8-author-b","blob":"76ba348c004f81e0b0887b2330a5680defacafc5","commit":"171635a5c5885fe975606c45c6eeeef158c60771","content_sha256":"22925d879cadb349e6ffeb73cd1b309c95a1046d6f3b2ab53a6b8a5487cdc1f5","path":"evals/ae-sq8/f2/split-b.json","raw_sha256":"e551983bc4f468ba7d9f702a397404ef0e0e8945658bc93d1a733cb6849161d0","tree":"80bf1846d51fe8e0b4962d910363798dbb7fab04"}],"authorship_performed":false,"claim_ceiling":"git-object-and-orchestrator-attested-validator-route-only-not-human-identity-or-off-git-observation","errors":[],"f1a_implementation":{"commit":"8454c9c712eaeedb14381956ac6144fd42dfbe39","role_ledger_sha256":"ba43d174e9324d50c4282d37902988ef6ac6699277296a5a8842dbe5970d071a","tree":"f12485bc43bc406c33ecebcd6a59628fb7f8f556"},"f1b_freeze":{"blob":"7357225b6e20964c77c3ce5ac609dbae2600c7f5","commit":"fb1c3dee8b9e3aaa77c12ad387af090ab26e410f","path":"evals/ae-sq8/f1/repaired-freeze.json","sha256":"37a698d0f854df5357326cc9ebea5c13b4b7086dc52c6c693d8f5ea2f4051b57","tree":"86174492f72dc65fad1675d38cb59bf16a4b6a1a"},"f1g_gate":{"blob":"c6dc9ac2100f255bcf8834a55b357a8ccade2621","commit":"7ea85f98762b79124e0323f5619e418ac0a55f09","path":"evals/ae-sq8/f1/author-template-gate.json","sha256":"4b539b531121db4ea6ac0d19bd28eeb41631fa1ac3867ab20d5eaafdcea94af9","tree":"6b40a897905874c28e626102fd9f15af981008d4"},"f2a_corpus":{"commit":"6ad83a4340d71408bcf38f51ccab8a60c2e1bbcf","ordered_parents":["7ea85f98762b79124e0323f5619e418ac0a55f09","3040aa21bd95dfcfe54bf60bf5735a54159bbcf2","171635a5c5885fe975606c45c6eeeef158c60771"],"tree":"a8f2f3129712518e8924a48c222140c7ad96e1a4"},"holds":[],"receipt_version":"ae-sq8-independent-validation-v1","status":"PASS","validator":{"blob":"f06920119b6a23e10f924847bcefbe3477937d53","commit":"8454c9c712eaeedb14381956ac6144fd42dfbe39","path":"scripts/validate_ae_sq8_corpus.py","raw_sha256":"81ce10a7f22db7fa701db6242ea62b261b50a3d94382657807c56dd36cab40b6","tree":"f12485bc43bc406c33ecebcd6a59628fb7f8f556","validator_id":"independent-nonauthor-validator"}}}